{
  "$schema": "../schemas/tool-runtime-lock.schema.json",
  "apiVersion": "gate.dev/tool-runtime-lock/v1",
  "kind": "ToolRuntimeLock",
  "updatePolicy": "reviewed-pull-request",
  "runtimes": [
    {
      "id": "subfinder",
      "toolId": "subfinder",
      "catalogEntrySha256": "45de32fbb1aa887d75319d71c915fe295c3bff9bc60d60fa1fcfc7f2ecefb612",
      "version": "2.17.0",
      "source": {
        "repository": "https://github.com/projectdiscovery/subfinder",
        "commit": "c97f25802892093060f0fc424bfc3f39e273693a",
        "tag": "v2.17.0"
      },
      "releaseEvidence": {
        "provider": "github",
        "releaseId": 406526961,
        "releaseApiUrl": "https://api.github.com/repos/projectdiscovery/subfinder/releases/406526961",
        "immutableObserved": false,
        "sourceCommitVerification": "verified",
        "checksumManifest": {
          "assetId": 621057188,
          "assetApiUrl": "https://api.github.com/repos/projectdiscovery/subfinder/releases/assets/621057188",
          "url": "https://github.com/projectdiscovery/subfinder/releases/download/v2.17.0/subfinder_2.17.0_checksums.txt",
          "size": 891,
          "sha256": "115acad346b14570ba1fbc98adb49bce97f9ed7e451de226d4c5b0b2087e495c"
        }
      },
      "provider": "verified-release",
      "executable": {
        "name": "subfinder",
        "relativePath": "bin/subfinder"
      },
      "artifacts": [
        {
          "platform": "linux-x64",
          "assetId": 621057185,
          "assetApiUrl": "https://api.github.com/repos/projectdiscovery/subfinder/releases/assets/621057185",
          "url": "https://github.com/projectdiscovery/subfinder/releases/download/v2.17.0/subfinder_2.17.0_linux_amd64.zip",
          "size": 10308162,
          "sha256": "a39c3e5c7a26ef3c430915c4d6cbf7716a00f26769a75e9405aba796142eba37",
          "archiveType": "zip",
          "entries": [
            "LICENSE.md",
            "README.md",
            "subfinder"
          ],
          "executablePath": "subfinder",
          "executableSha256": "bf4ad8590702b0bb92be9b3be185f96a230b047c9b97f2831cf8914344f0b15a"
        },
        {
          "platform": "linux-arm64",
          "assetId": 621057186,
          "assetApiUrl": "https://api.github.com/repos/projectdiscovery/subfinder/releases/assets/621057186",
          "url": "https://github.com/projectdiscovery/subfinder/releases/download/v2.17.0/subfinder_2.17.0_linux_arm64.zip",
          "size": 9378288,
          "sha256": "24913d49dddc1d3a5e99a4a7580da5be980959b9415b96f52c4f7f4124392190",
          "archiveType": "zip",
          "entries": [
            "LICENSE.md",
            "README.md",
            "subfinder"
          ],
          "executablePath": "subfinder",
          "executableSha256": "e6a8fb863f26315b8ab79a956d79847fd91970045979c374874e0755cabe7588"
        },
        {
          "platform": "darwin-x64",
          "assetId": 621057197,
          "assetApiUrl": "https://api.github.com/repos/projectdiscovery/subfinder/releases/assets/621057197",
          "url": "https://github.com/projectdiscovery/subfinder/releases/download/v2.17.0/subfinder_2.17.0_macOS_amd64.zip",
          "size": 10584491,
          "sha256": "75bf5990b409c6fd1116c81cd64fbdfd2cfd5bfb1f43542035b42344cb9fdffa",
          "archiveType": "zip",
          "entries": [
            "LICENSE.md",
            "README.md",
            "subfinder"
          ],
          "executablePath": "subfinder",
          "executableSha256": "d955da837d78dfdc0736a3b7c20f0566b95a248ce047f4e34395a050394aa6b2"
        },
        {
          "platform": "darwin-arm64",
          "assetId": 621057199,
          "assetApiUrl": "https://api.github.com/repos/projectdiscovery/subfinder/releases/assets/621057199",
          "url": "https://github.com/projectdiscovery/subfinder/releases/download/v2.17.0/subfinder_2.17.0_macOS_arm64.zip",
          "size": 9883401,
          "sha256": "012d6ff91ef932ac6d1a321fb5735cf1412168d163e6adbc6cbe5fc42fe03c3b",
          "archiveType": "zip",
          "entries": [
            "LICENSE.md",
            "README.md",
            "subfinder"
          ],
          "executablePath": "subfinder",
          "executableSha256": "ddef1d9d1eb6659987d3685b49fdf4a8680be4b4dbf14545d5c25a8aba436f92"
        }
      ],
      "smoke": {
        "argv": [
          "-version",
          "-nc"
        ],
        "expectedOutputContains": "2.17.0",
        "timeoutMs": 15000,
        "maxOutputBytes": 65536,
        "maxProcesses": 32,
        "network": "none",
        "sandbox": "bubblewrap-prlimit-v1"
      },
      "effects": {
        "networkDuringInstall": true,
        "hostWrites": false,
        "adminRequired": false,
        "services": false,
        "devices": false
      }
    },
    {
      "id": "httpx",
      "toolId": "httpx",
      "catalogEntrySha256": "38b5530e56ef698f92ba3d5942d9bfa0cb48bfac3490ca515f323666ed66100b",
      "version": "1.12.0",
      "source": {
        "repository": "https://github.com/projectdiscovery/httpx",
        "commit": "4b6a9a9d476f94a4f3a630f37051f5671ecfb1f8",
        "tag": "v1.12.0"
      },
      "releaseEvidence": {
        "provider": "github",
        "releaseId": 384760174,
        "releaseApiUrl": "https://api.github.com/repos/projectdiscovery/httpx/releases/384760174",
        "immutableObserved": false,
        "sourceCommitVerification": "verified",
        "checksumManifest": {
          "assetId": 550577473,
          "assetApiUrl": "https://api.github.com/repos/projectdiscovery/httpx/releases/assets/550577473",
          "url": "https://github.com/projectdiscovery/httpx/releases/download/v1.12.0/httpx_1.12.0_checksums.txt",
          "size": 758,
          "sha256": "541586a8d1bc7e30f3f31ff954baca6ac3e02cd74363378b7773375a78259c02"
        }
      },
      "provider": "verified-release",
      "executable": {
        "name": "httpx",
        "relativePath": "bin/httpx"
      },
      "artifacts": [
        {
          "platform": "linux-x64",
          "assetId": 550577479,
          "assetApiUrl": "https://api.github.com/repos/projectdiscovery/httpx/releases/assets/550577479",
          "url": "https://github.com/projectdiscovery/httpx/releases/download/v1.12.0/httpx_1.12.0_linux_amd64.zip",
          "size": 19200026,
          "sha256": "9d8439e8b6c9aa7d1e2314817a392e00d5178da3af5652f7475f88868f418f76",
          "archiveType": "zip",
          "entries": [
            "LICENSE.md",
            "README.md",
            "httpx"
          ],
          "executablePath": "httpx",
          "executableSha256": "6d78b83b4da452a7e0bd3613c4fae04cbf523209f083904b563f4d4406a680b0"
        },
        {
          "platform": "linux-arm64",
          "assetId": 550577476,
          "assetApiUrl": "https://api.github.com/repos/projectdiscovery/httpx/releases/assets/550577476",
          "url": "https://github.com/projectdiscovery/httpx/releases/download/v1.12.0/httpx_1.12.0_linux_arm64.zip",
          "size": 17927774,
          "sha256": "fd7b123c1dfbc3d69f19f524e4eebcd6ec06b9a6cbd56813c76f11645197331e",
          "archiveType": "zip",
          "entries": [
            "LICENSE.md",
            "README.md",
            "httpx"
          ],
          "executablePath": "httpx",
          "executableSha256": "28dec1033bf23c29bd2b3b0c65589f01efc8d726f3eb056ef5ce6bc19566ef7c"
        },
        {
          "platform": "darwin-x64",
          "assetId": 550577477,
          "assetApiUrl": "https://api.github.com/repos/projectdiscovery/httpx/releases/assets/550577477",
          "url": "https://github.com/projectdiscovery/httpx/releases/download/v1.12.0/httpx_1.12.0_macOS_amd64.zip",
          "size": 19702544,
          "sha256": "16760b5e2122b66f57b9fbdb59f564b1181507c093d6a36066f40e5de38e8fa9",
          "archiveType": "zip",
          "entries": [
            "LICENSE.md",
            "README.md",
            "httpx"
          ],
          "executablePath": "httpx",
          "executableSha256": "782ae2efd1e33ae5a67640df16f8fb9698b28d351c4959b67e222849423e9005"
        },
        {
          "platform": "darwin-arm64",
          "assetId": 550577478,
          "assetApiUrl": "https://api.github.com/repos/projectdiscovery/httpx/releases/assets/550577478",
          "url": "https://github.com/projectdiscovery/httpx/releases/download/v1.12.0/httpx_1.12.0_macOS_arm64.zip",
          "size": 18856626,
          "sha256": "21d60328b383dba8a9fe249ac76b12edda4ec2e52a9cb21876c0a79123675569",
          "archiveType": "zip",
          "entries": [
            "LICENSE.md",
            "README.md",
            "httpx"
          ],
          "executablePath": "httpx",
          "executableSha256": "34c76faace5657d2deb7e9ae4060e6a15c95c0b8311fcfb268d68f37dab0f67e"
        }
      ],
      "smoke": {
        "argv": [
          "-version",
          "-nc"
        ],
        "expectedOutputContains": "1.12.0",
        "timeoutMs": 15000,
        "maxOutputBytes": 65536,
        "maxProcesses": 32,
        "network": "none",
        "sandbox": "bubblewrap-prlimit-v1"
      },
      "effects": {
        "networkDuringInstall": true,
        "hostWrites": false,
        "adminRequired": false,
        "services": false,
        "devices": false
      }
    },
    {
      "id": "dnsx",
      "toolId": "dnsx",
      "catalogEntrySha256": "a59d0e3df6ecb6b4d687ecbcfd1324d9541e83f0b89f99f998ba10a9e485bcfc",
      "version": "1.3.1",
      "source": {
        "repository": "https://github.com/projectdiscovery/dnsx",
        "commit": "01e315f216db7d36198ec326fac13dd7846b1bec",
        "tag": "v1.3.1"
      },
      "releaseEvidence": {
        "provider": "github",
        "releaseId": 379526662,
        "releaseApiUrl": "https://api.github.com/repos/projectdiscovery/dnsx/releases/379526662",
        "immutableObserved": false,
        "sourceCommitVerification": "verified",
        "checksumManifest": {
          "assetId": 537497996,